Catégorie;field_label;Définition;Variantes/Synonymes;regex_pattern
Preuves et Justificatifs;Liens vers feuilles de soins;URL ou référence des feuilles de soins;FEUILLES DE SOINS|SOINS ONLINE;(?i)^\sFEUILLES?\s+DE\s+SOINS\b
Preuves et Justificatifs;Ordonnances jointes;Références ou copies d’ordonnances;ORDONNANCE|PRESCRIPTION;(?i)^\sORDONNANCE\b
Preuves et Justificatifs;Bordereaux d’expédition / hospitalisation;Documents d’admission ou d’expédition d’échantillons;BORDEREAU|ADMISSION;(?i)^\sBORDEREAU\b
Mode de Livraison;Mode de livraison / réception;Comment la facture ou documents ont été remis;REMISE EN MAIN PROPRE|ENVOI POSTAL;(?i)^\sREMISE\b
Mode de Livraison;Date et heure de remise;Date et heure précises de la remise;LE \d{2}/\d{2}/\d{4} à \d{2}:\d{2};(?i)^\sLE\s\d{2}/\d{2}/\d{4}\sà\s\d{2}:\d{2}\b